[{
  "_id": {
    "$oid": "685827c746b7696e78ce8765"
  },
  "productCode": "X1504GA-NJ322W",
  "byOrder": false,
  "byOrderDate": null,
  "cateId": 25,
  "cateName": "Notebooks",
  "categoryId": 121,
  "clearAnce": false,
  "compare": {
    "cate_sub1": "24",
    "cate_sub2": "25",
    "cate_sub3": "121",
    "compare_lv": 2
  },
  "createdAt": {
    "$date": "2024-02-20T09:06:22.000Z"
  },
  "description": "• Intel Core i3-N305\r\n• 8GB DDR4 (ON BOARD)\r\n• 512GB PCIe/NVMe M.2 SSD\r\n• 15.6\" FHD Anti-Glare\r\n• Intel UHD Graphics (Integrated)\r\n• Windows 11 Home",
  "freeShipping": true,
  "highlights_detail": "",
  "id": 65577,
  "images": {
    "original": {
      "width": "0",
      "heigth": "0",
      "url": [
        "https://www.jib.co.th/img_master/product/original/20240220162537_65577_287_1.jpg"
      ]
    },
    "icon": {
      "width": "50px",
      "heigth": "50px",
      "url": [
        "https://www.jib.co.th/img_master/product/icon/20240220162537_65577_287_1.jpg"
      ]
    },
    "small": {
      "width": "150px",
      "heigth": "150px",
      "url": [
        "https://www.jib.co.th/img_master/product/small/20240220162537_65577_287_1.jpg"
      ]
    },
    "medium": {
      "width": "280px",
      "heigth": "280px",
      "url": [
        "https://www.jib.co.th/img_master/product/medium/20240220162537_65577_287_1.jpg"
      ]
    },
    "large": {
      "width": "550px",
      "heigth": "550px",
      "url": [
        "https://www.jib.co.th/img_master/product/big/20240220162537_65577_287_1.jpg"
      ]
    }
  },
  "logo": {
    "freeItemOri": {
      "url": [
        "https://www.jib.co.th/img_master/images/promotion/original/20240827102346_1.jpg"
      ],
      "title": [
        "( เฉพาะสั่งซื้อ ออนไลน์ เท่านั้น )  GIFTBOX JIB SMILEY FOR NOTEBOOK"
      ]
    },
    "shipping": [
      {
        "url": "",
        "title": "",
        "key": "",
        "locationStatus": ""
      }
    ],
    "installment": {
      "url": [
        "https://www.jib.co.th/img_master/img/zero-percent-kbank.png?v=1001",
        "https://www.jib.co.th/img_master/img/610517-logo-ktc2020-04-01.png?v=1003",
        "https://www.jib.co.th/img_master/img/logo-ผ่อนสินค้า-06.png?v=1004",
        "https://www.jib.co.th/img_master/img/kfc0-2020-03-24.png?v=1003"
      ],
      "title": [
        "เจไอบี มอบเเคมเปญ เเบ่งชำระ 0% ผ่านบัตรเครดิตของธนาคารกสิกรไทย",
        "เจไอบี มอบแคมเปญ แบ่งชำระ 0% ผ่านบัตรเครดิตของธนาคารกรุงไทย",
        "เจไอบี มอบแคมเปญ แบ่งชำระ 0% ผ่านบัตรเครดิตของธนาคารกรุงศรีอยุธยา",
        "เจไอบี มอบแคมเปญ แบ่งชำระ 0% ผ่านบัตรกรุงศรี เฟิร์สช้อยส์"
      ],
      "logo_search": [
        "kbank",
        "ktc",
        "kcc",
        "kfc"
      ]
    },
    "freeItem": {
      "url": [
        "https://www.jib.co.th/img_master/images/promotion/small/20240827102346_1.jpg"
      ],
      "title": [
        "( เฉพาะสั่งซื้อ ออนไลน์ เท่านั้น )  GIFTBOX JIB SMILEY FOR NOTEBOOK"
      ]
    },
    "code": "",
    "code_discount": "",
    "show_on_web": "",
    "supplier": [],
    "c_icon": null,
    "icon_ai": null,
    "icon_ict": null,
    "icon_asus": null
  },
  "preOrder": false,
  "preOrderDate": null,
  "price": 11990,
  "product360": true,
  "productLocation": "75",
  "productView": 38351,
  "product_ict": null,
  "product_ict_comment": null,
  "product_warranty_2_year": null,
  "product_warranty_3_year": null,
  "product_windows": null,
  "rating": 0,
  "salePrice": 10990,
  "stockQuantity": 2,
  "title": "NOTEBOOK (โน้ตบุ๊ค) ASUS VIVOBOOK GO 15 X1504GA-NJ322W (MIXED BLACK)",
  "totalReviews": 0,
  "updatedAt": {
    "$date": "2024-08-09T14:18:59.000Z"
  }
},
{
  "_id": {
    "$oid": "685827c746b7696e78ce8766"
  },
  "productCode": "M1504FA-NJ516W",
  "byOrder": false,
  "byOrderDate": null,
  "cateId": 25,
  "cateName": "Notebooks",
  "categoryId": 121,
  "clearAnce": false,
  "compare": {
    "cate_sub1": "24",
    "cate_sub2": "25",
    "cate_sub3": "121",
    "compare_lv": 2
  },
  "createdAt": {
    "$date": "2024-03-29T15:37:19.000Z"
  },
  "description": "• AMD Ryzen 5 7520U\r\n• 8GB LPDDR5 (ON BOARD)\r\n• 512GB PCIe/NVMe M.2 SSD\r\n• 15.6\" FHD Anti-Glare\r\n• AMD Radeon Graphics (Integrated)\r\n• Windows 11 Home",
  "freeShipping": true,
  "highlights_detail": "",
  "id": 66554,
  "images": {
    "original": {
      "width": "0",
      "heigth": "0",
      "url": [
        "https://www.jib.co.th/img_master/product/original/20240401145220_66554_287_1.jpg"
      ]
    },
    "icon": {
      "width": "50px",
      "heigth": "50px",
      "url": [
        "https://www.jib.co.th/img_master/product/icon/20240401145220_66554_287_1.jpg"
      ]
    },
    "small": {
      "width": "150px",
      "heigth": "150px",
      "url": [
        "https://www.jib.co.th/img_master/product/small/20240401145220_66554_287_1.jpg"
      ]
    },
    "medium": {
      "width": "280px",
      "heigth": "280px",
      "url": [
        "https://www.jib.co.th/img_master/product/medium/20240401145220_66554_287_1.jpg"
      ]
    },
    "large": {
      "width": "550px",
      "heigth": "550px",
      "url": [
        "https://www.jib.co.th/img_master/product/big/20240401145220_66554_287_1.jpg"
      ]
    }
  },
  "logo": {
    "freeItemOri": {
      "url": [
        "https://www.jib.co.th/img_master/images/promotion/original/20240827102346_1.jpg"
      ],
      "title": [
        "( เฉพาะสั่งซื้อ ออนไลน์ เท่านั้น )  GIFTBOX JIB SMILEY FOR NOTEBOOK"
      ]
    },
    "shipping": [
      {
        "url": "",
        "title": "",
        "key": "",
        "locationStatus": ""
      }
    ],
    "installment": {
      "url": [
        "https://www.jib.co.th/img_master/img/zero-percent-kbank.png?v=1001",
        "https://www.jib.co.th/img_master/img/610517-logo-ktc2020-04-01.png?v=1003",
        "https://www.jib.co.th/img_master/img/logo-ผ่อนสินค้า-06.png?v=1004",
        "https://www.jib.co.th/img_master/img/kfc0-2020-03-24.png?v=1003"
      ],
      "title": [
        "เจไอบี มอบเเคมเปญ เเบ่งชำระ 0% ผ่านบัตรเครดิตของธนาคารกสิกรไทย",
        "เจไอบี มอบแคมเปญ แบ่งชำระ 0% ผ่านบัตรเครดิตของธนาคารกรุงไทย",
        "เจไอบี มอบแคมเปญ แบ่งชำระ 0% ผ่านบัตรเครดิตของธนาคารกรุงศรีอยุธยา",
        "เจไอบี มอบแคมเปญ แบ่งชำระ 0% ผ่านบัตรกรุงศรี เฟิร์สช้อยส์"
      ],
      "logo_search": [
        "kbank",
        "ktc",
        "kcc",
        "kfc"
      ]
    },
    "freeItem": {
      "url": [
        "https://www.jib.co.th/img_master/images/promotion/small/20240827102346_1.jpg"
      ],
      "title": [
        "( เฉพาะสั่งซื้อ ออนไลน์ เท่านั้น )  GIFTBOX JIB SMILEY FOR NOTEBOOK"
      ]
    },
    "code": "",
    "code_discount": "",
    "show_on_web": "",
    "supplier": [],
    "c_icon": null,
    "icon_ai": null,
    "icon_ict": null,
    "icon_asus": null
  },
  "preOrder": false,
  "preOrderDate": null,
  "price": 13990,
  "product360": true,
  "productLocation": "75",
  "productView": 35075,
  "product_ict": null,
  "product_ict_comment": null,
  "product_warranty_2_year": null,
  "product_warranty_3_year": null,
  "product_windows": null,
  "rating": 0,
  "salePrice": 12990,
  "stockQuantity": 3,
  "title": "NOTEBOOK (โน้ตบุ๊ค) ASUS VIVOBOOK GO 15 M1504FA-NJ516W (MIXED BLACK)",
  "totalReviews": 0,
  "updatedAt": {
    "$date": "2024-10-08T10:54:36.000Z"
  }
},
{
  "_id": {
    "$oid": "685827c946b7696e78ce877e"
  },
  "productCode": "NX.J23ST.002",
  "byOrder": false,
  "byOrderDate": null,
  "cateId": 25,
  "cateName": "Notebooks",
  "categoryId": 32,
  "clearAnce": false,
  "compare": {
    "cate_sub1": "24",
    "cate_sub2": "25",
    "cate_sub3": "32",
    "compare_lv": 2
  },
  "createdAt": {
    "$date": "2024-11-13T15:54:14.000Z"
  },
  "description": "• Intel Core i3-1305U\r\n• 8GB DDR5\r\n• 512GB NVMe PCIe M.2 SSD\r\n• 16\" WUXGA (1920 x 1200) IPS Non-Touch\r\n• Intel Graphics (Integrated)\r\n• Windows 11 Home + Office Home & Student 2021",
  "freeShipping": true,
  "highlights_detail": "",
  "id": 72074,
  "images": {
    "original": {
      "width": "0",
      "heigth": "0",
      "url": [
        "https://www.jib.co.th/img_master/product/original/20241114133718_72074_287_1.jpg"
      ]
    },
    "icon": {
      "width": "50px",
      "heigth": "50px",
      "url": [
        "https://www.jib.co.th/img_master/product/icon/20241114133718_72074_287_1.jpg"
      ]
    },
    "small": {
      "width": "150px",
      "heigth": "150px",
      "url": [
        "https://www.jib.co.th/img_master/product/small/20241114133718_72074_287_1.jpg"
      ]
    },
    "medium": {
      "width": "280px",
      "heigth": "280px",
      "url": [
        "https://www.jib.co.th/img_master/product/medium/20241114133718_72074_287_1.jpg"
      ]
    },
    "large": {
      "width": "550px",
      "heigth": "550px",
      "url": [
        "https://www.jib.co.th/img_master/product/big/20241114133718_72074_287_1.jpg"
      ]
    }
  },
  "logo": {
    "freeItemOri": {
      "url": [
        "https://www.jib.co.th/img_master/images/promotion/original/20230627152606_1.jpg",
        "https://www.jib.co.th/img_master/images/promotion/original/20240827102346_1.jpg"
      ],
      "title": [
        "( เฉพาะสั่งซื้อ ออนไลน์ เท่านั้น ) BAG ACER PREDATOR CANVAS SLIM BACKPACK",
        "( เฉพาะสั่งซื้อ ออนไลน์ เท่านั้น )  GIFTBOX JIB SMILEY FOR NOTEBOOK"
      ]
    },
    "shipping": [
      {
        "url": "",
        "title": "",
        "key": "",
        "locationStatus": ""
      }
    ],
    "installment": {
      "url": [
        "https://www.jib.co.th/img_master/img/zero-percent-kbank.png?v=1001",
        "https://www.jib.co.th/img_master/img/610517-logo-ktc2020-04-01.png?v=1003",
        "https://www.jib.co.th/img_master/img/logo-ผ่อนสินค้า-06.png?v=1004",
        "https://www.jib.co.th/img_master/img/kfc0-2020-03-24.png?v=1003"
      ],
      "title": [
        "เจไอบี มอบเเคมเปญ เเบ่งชำระ 0% ผ่านบัตรเครดิตของธนาคารกสิกรไทย",
        "เจไอบี มอบแคมเปญ แบ่งชำระ 0% ผ่านบัตรเครดิตของธนาคารกรุงไทย",